{"$schema":"https://json-schema.org/draft/2020-12/schema","$id":"https://ndoracle.org/schema/types/question-v0.2.json","title":"ND Oracle question object v0.2","type":"object","additionalProperties":false,"required":["schema_version","id","type","status","provenance","question","why_it_matters","related_objects","current_understanding","evidence_needed","reopening_conditions"],"properties":{"schema_version":{"const":"0.2"},"id":{"$ref":"https://ndoracle.org/schema/common-v0.2.json#/$defs/identifier"},"type":{"const":"question"},"status":{"enum":["open","partially_resolved","resolved","not_currently_answerable"]},"provenance":{"$ref":"https://ndoracle.org/schema/common-v0.2.json#/$defs/provenance"},"question":{"$ref":"https://ndoracle.org/schema/common-v0.2.json#/$defs/nonBlankString"},"why_it_matters":{"$ref":"https://ndoracle.org/schema/common-v0.2.json#/$defs/nonBlankString"},"related_objects":{"type":"array","minItems":1,"items":{"$ref":"https://ndoracle.org/schema/common-v0.2.json#/$defs/typedReference"}},"current_understanding":{"$ref":"https://ndoracle.org/schema/common-v0.2.json#/$defs/nonBlankString"},"evidence_needed":{"type":"array","minItems":1,"items":{"$ref":"https://ndoracle.org/schema/common-v0.2.json#/$defs/nonBlankString"}},"reopening_conditions":{"type":"array","minItems":1,"items":{"$ref":"https://ndoracle.org/schema/common-v0.2.json#/$defs/nonBlankString"}},"resolution_evidence_ids":{"type":"array","items":{"$ref":"https://ndoracle.org/schema/common-v0.2.json#/$defs/identifier"},"uniqueItems":true},"dissent":{"type":"array","items":{"$ref":"https://ndoracle.org/schema/common-v0.2.json#/$defs/nonBlankString"}}}}