{"schema_version":"0.2","id":"clothing-touch-sensory-discomfort","type":"question","status":"partially_resolved","provenance":{"created":"2026-09-03","created_by":"ND Oracle project-controlled curation","method":"Sensory-domain expansion focused on person-controlled clothing variables.","review_state":"editor_reviewed","last_reviewed":"2026-09-03"},"question":"Clothing seams, labels, pressure or fabric feel unbearable. What variables can I change?","why_it_matters":"Clothing is continuous sensory exposure, so a small mismatch can consume attention or make leaving home and work/school participation harder.","related_objects":[{"type":"concept","id":"sensory-processing"},{"type":"concept","id":"sensory-overload"}],"current_understanding":"Inspect the specific input: seam position, labels, fabric texture, tightness, waistbands, temperature, layering and footwear. Person-controlled substitutions are reasonable to test where dress or safety requirements allow. Sudden new skin pain, rash or other medical symptoms need health assessment rather than a sensory assumption.","evidence_needed":["Research comparing practical clothing adaptations for tactile sensitivity.","Work and school uniform accommodation guidance with neurodivergent examples."],"reopening_conditions":["Better evidence supports specific clothing interventions.","Reviewed uniform-adjustment guidance broadens practical options."],"dissent":["Preferences can change by fatigue, stress and temperature; a fixed 'sensory-safe' wardrobe may not stay safe every day."]}