{"schema_version":"0.2","id":"relationship-safety-domestic-abuse-help","type":"question","status":"partially_resolved","provenance":{"created":"2026-09-03","created_by":"ND Oracle project-controlled curation","method":"Question created for the Relationships & family UK v1 bounded coverage slice from reviewed first-party/specialist routes and existing governed Concepts; it preserves uncertainty and does not create personalised relationship, diagnostic, legal or safeguarding authority.","review_state":"editor_reviewed","last_reviewed":"2026-09-03"},"question":"Where can I look for help if a partner or family member is frightening, controlling or abusive?","why_it_matters":"Fear, control, violence and sexual pressure should not be reduced to a communication mismatch or explained away by neurodivergence.","related_objects":[{"type":"resource","id":"govuk-domestic-abuse-help"},{"type":"concept","id":"communication-differences"}],"current_understanding":"ND Oracle cannot determine from a short description whether abuse has occurred. It can route to official information about signs of domestic abuse, immediate danger and current nation-specific support. If there is immediate danger, use the emergency route on the official guidance rather than waiting for ND Oracle to interpret the situation.","evidence_needed":["More accessible domestic-abuse resources explicitly addressing disabled and neurodivergent people across all UK nations.","Evidence about communication-access barriers in safeguarding and domestic-abuse services."],"reopening_conditions":["Official support routes or emergency instructions change.","Stronger accessible first-party safeguarding information becomes available."],"dissent":["Neurodivergence does not excuse coercion, threats, violence or sexual pressure, and ordinary relationship advice is not a substitute for safeguarding support."]}