{"schema_version":"0.2","id":"assessment-refused-or-disagree-uk","type":"question","status":"partially_resolved","provenance":{"created":"2026-09-03","created_by":"ND Oracle project-controlled curation","method":"Cross-UK route assembled from current public assessment guidance. England's explicit NHS second-opinion wording is kept England-specific; elsewhere the route directs readers to the relevant service/GP/Trust/board process rather than inventing a uniform right.","review_state":"editor_reviewed","last_reviewed":"2026-09-03"},"question":"What can I do if an autism or ADHD referral is refused, or I disagree with an assessment outcome in the UK?","why_it_matters":"A refused referral, discharge after triage, no-diagnosis result, factual error and disagreement with a clinical conclusion are different problems and may have different review or complaint routes.","related_objects":[{"type":"concept","id":"autism"},{"type":"concept","id":"adhd"},{"type":"resource","id":"nhs-england-autism-assessments"},{"type":"resource","id":"nhs-inform-autism-adults-scotland"},{"type":"resource","id":"cardiff-vale-adult-autism-assessment"},{"type":"resource","id":"nidirect-autism-assessment-northern-ireland"}],"current_understanding":"First ask the referrer or assessment service to explain what decision was made and why: a referral may have been declined, triage may have concluded that a full assessment is not indicated, or a completed assessment may have reached a no-diagnosis or different conclusion. Check whether missing or inaccurate factual information can be supplied or corrected and what the local review, re-referral, second-opinion or complaint route is. The NHS England autism page explicitly says that a person who disagrees with the result can ask the GP or assessment team about referral to another team for a second opinion; ND Oracle does not generalise that exact mechanism as a UK-wide entitlement. In Scotland, Wales and Northern Ireland the practical route must be checked with the relevant NHS board, health board/HSC Trust, GP or service. Disagreement alone does not establish that the assessment was wrong, and a service decision does not erase support needs that may still require attention.","evidence_needed":["Current nation- and service-level second-opinion, re-referral, records-correction and complaints routes for autism and ADHD assessments outside the explicit England NHS autism example."],"reopening_conditions":["National health services publish materially different second-opinion or neurodevelopmental review rules.","Local service review/complaint arrangements materially change."],"dissent":["Clinical disagreement can reflect new evidence, a flawed process, genuinely uncertain presentation or a defensible difference in professional judgement; ND Oracle should preserve those possibilities rather than declaring either side correct." ]}
