{"schema_version":"0.2","id":"disabled-student-support-england","type":"question","status":"partially_resolved","provenance":{"created":"2026-08-28","created_by":"ND Oracle project-controlled curation","method":"Practical discovery question assembled from the reviewed Disabled Students' Allowance Resource and related Concepts. It records the current England student-finance route without making an individual eligibility decision.","review_state":"editor_reviewed","last_reviewed":"2026-08-28"},"question":"Where can I look for disability-related study support in higher education in England?","why_it_matters":"Students may know that support exists but not whether it comes from their university, student finance, a disability service or another route, and application rules can change between academic years.","related_objects":[{"type":"resource","id":"disabled-students-allowance"},{"type":"concept","id":"autism"},{"type":"concept","id":"adhd"},{"type":"concept","id":"dyslexia"},{"type":"concept","id":"developmental-coordination-disorder"},{"type":"concept","id":"developmental-language-disorder"}],"current_understanding":"Disabled Students' Allowance (DSA) is the current Student Finance England/GOV.UK route in the ND Oracle catalogue for disability-related study costs in higher education. The current rules cover a range of disability, health and specific-learning-difficulty contexts, but eligibility, evidence requirements and application processes depend on the academic year and individual circumstances. University disability services and other support can exist alongside DSA.","evidence_needed":["Current Student Finance England rules for each academic year.","Reviewed university-support and devolved-nation routes so the answer is not limited to England or to DSA."],"reopening_conditions":["Student Finance England changes DSA eligibility, evidence, funding or application arrangements.","The Lifelong Learning Entitlement changes the application route for affected courses.","Reviewed Scotland, Wales or Northern Ireland student-support routes are added."],"dissent":["DSA is only one part of disabled-student support; institutional adjustments, teaching practice, accessibility and other funding routes can matter separately."]}