{"schema_version":"0.2","id":"hospital-appointment-reasonable-adjustments","type":"question","status":"partially_resolved","provenance":{"created":"2026-09-03","created_by":"ND Oracle project-controlled curation","method":"Healthcare-access expansion using current NHS adjustment examples while preserving audience and jurisdiction limits.","review_state":"editor_reviewed","last_reviewed":"2026-09-03"},"question":"Hospital appointments or admissions are hard because of disability or neurodivergent needs. What reasonable-adjustment questions can I prepare?","why_it_matters":"Hospital environments combine unfamiliar routines, communication, waiting, sensory load and high-stakes information.","related_objects":[{"type":"resource","id":"nhs-hospital-reasonable-adjustments"},{"type":"resource","id":"nhs-england-reasonable-adjustment-digital-flag"},{"type":"concept","id":"sensory-processing"}],"current_understanding":"Translate needs into concrete barriers: accessible information, extra processing time, a quieter waiting option, support-person arrangements, predictable explanation or communication format. The NHS source gives examples rather than a universal list. England's digital flag is one implementation mechanism and must not be projected onto other nations.","evidence_needed":["Four-nation hospital-specific reasonable-adjustment implementation evidence.","Information about how patients can record and review adjustment needs outside England."],"reopening_conditions":["National health services change their adjustment-recording systems.","Reviewed hospital accessibility standards provide stronger operational detail."],"dissent":["Some adjustments can conflict with clinical workflow or safety; the useful route is early discussion, not assuming every request can always be met exactly."]}