{"schema_version":"0.2","id":"organising-study-and-assignments","type":"question","status":"partially_resolved","provenance":{"created":"2026-08-28","created_by":"ND Oracle project-controlled curation","method":"Practical discovery question assembled from reviewed ND Oracle Concepts and claimless Resource listings. The route distinguishes descriptive information, jurisdiction and access from claims that a strategy or service will work for an individual.","review_state":"editor_reviewed","last_reviewed":"2026-08-28"},"question":"I lose track of study tasks and assignments. What tools or supports can I inspect?","why_it_matters":"Study work combines task initiation, time estimation, reading, writing and remembering multiple deadlines, so one generic productivity tip often misses the actual bottleneck.","related_objects":[{"type":"concept","id":"executive-function"},{"type":"concept","id":"task-initiation"},{"type":"resource","id":"microsoft-to-do"},{"type":"resource","id":"tiimo"},{"type":"resource","id":"time-timer"},{"type":"resource","id":"texthelp-read-write"},{"type":"resource","id":"microsoft-immersive-reader"}],"current_understanding":"First identify whether the main barrier is remembering tasks, deciding the next action, estimating time, starting, reading material or producing written work. Task lists, visual schedules and timers can externalise planning; literacy tools can change how text is read or produced. None of these listings proves improved academic outcomes, and adding more tools can increase maintenance load, so a small system matched to the actual bottleneck is easier to evaluate.","evidence_needed":["Independent comparative evidence for study-support tools and combinations.","More student-led evidence about burden, abandonment and long-term fit."],"reopening_conditions":["Major listed tools materially change access, pricing or function.","A reviewed education support route is added for the relevant nation or institution type."],"dissent":["Some students work better with fewer reminders or less visible planning; more structure is not automatically better."]}
