{"schema_version":"0.2","id":"sensory-overload-what-can-i-change","type":"question","status":"partially_resolved","provenance":{"created":"2026-08-28","created_by":"ND Oracle project-controlled curation","method":"Practical discovery question assembled from reviewed ND Oracle Concepts and claimless Resource listings. The route distinguishes descriptive information, jurisdiction and access from claims that a strategy or service will work for an individual.","review_state":"editor_reviewed","last_reviewed":"2026-08-28"},"question":"I get overwhelmed by sensory input. What can I change first?","why_it_matters":"When several sounds, lights, textures, people or demands arrive together, generic advice to 'cope better' can miss the fact that the environment itself may be changeable.","related_objects":[{"type":"concept","id":"sensory-overload"},{"type":"concept","id":"sensory-processing"},{"type":"resource","id":"autistica-tips-hub"}],"current_understanding":"Start by identifying the specific input and the degree of control you have over it: intensity, predictability, duration, crowding and whether you can pause or leave. Current sensory research supports strong individual and context variation, so ND Oracle does not prescribe one sensory aid. Environmental changes, advance information, breaks and personal control are reasonable things to inspect before assuming the person must tolerate more.","evidence_needed":["Comparative evidence on specific environmental changes and person-defined outcomes.","More evidence across neurotypes and communication modes, not only autistic convenience samples."],"reopening_conditions":["A new reviewed sensory-support resource is added.","Evidence changes the understanding of sensory overload or environmental modifications.","The question is narrowed to a specific setting such as work, school or healthcare."],"dissent":["Some people actively seek intense sensory input that overwhelms someone else; reducing stimulation is not automatically the right goal."]}
