{"schema_version":"0.2","id":"staying-in-work-performance-process-adjustments","type":"question","status":"partially_resolved","provenance":{"created":"2026-09-03","created_by":"ND Oracle project-controlled curation","method":"Work expansion using current Acas performance and adjustment guidance while keeping Great Britain and Northern Ireland legal routes distinct.","review_state":"editor_reviewed","last_reviewed":"2026-09-03"},"question":"I am struggling to stay in work and performance concerns have started. How can I separate support needs from the formal process?","why_it_matters":"A performance process can move quickly while disability-related barriers, unclear expectations or missing adjustments remain unresolved.","related_objects":[{"type":"resource","id":"acas-performance-and-adjustments"},{"type":"resource","id":"acas-reasonable-adjustments"}],"current_understanding":"In Great Britain, inspect the employer's stated performance concerns, expected standard, evidence, support already tried and whether disability-related barriers or reasonable adjustments need discussion. Acas guidance can explain process principles but does not decide whether a particular warning or dismissal is lawful. Northern Ireland uses different employment-law advice routes.","evidence_needed":["A reviewed Northern Ireland equivalent for performance-process and disability-adjustment guidance.","Evidence on workplace retention interventions for neurodivergent employees."],"reopening_conditions":["Acas guidance or employment law materially changes.","A stronger Northern Ireland route is governed."],"dissent":["Not every performance problem is caused by missing adjustments, and an adjustment is not a guarantee that every role requirement can be changed."]}