{"schema_version":"0.2","id":"job-interview-adjustments-great-britain","type":"question","status":"partially_resolved","provenance":{"created":"2026-08-28","created_by":"ND Oracle project-controlled curation","method":"Practical discovery question assembled from reviewed ND Oracle Concepts and claimless Resource listings. The route distinguishes descriptive information, jurisdiction and access from claims that a strategy or service will work for an individual.","review_state":"editor_reviewed","last_reviewed":"2026-08-28"},"question":"What can I inspect if I need adjustments for a job application or interview in Great Britain?","why_it_matters":"Recruitment processes can create barriers before someone has an employer relationship or access to workplace support.","related_objects":[{"type":"resource","id":"acas-reasonable-adjustments"},{"type":"resource","id":"scope-support-to-work"},{"type":"resource","id":"evenbreak-career-hive"},{"type":"concept","id":"communication-differences"},{"type":"concept","id":"sensory-overload"}],"current_understanding":"Start with the barrier rather than a diagnosis label: timing, interview format, written versus spoken questions, inaccessible tests, sensory environment or communication method. Acas provides the current Great Britain employment-adjustment guidance in the catalogue; Scope and Evenbreak provide disability-focused employment information. ND Oracle does not decide what adjustment is legally required or guarantee that an employer will agree.","evidence_needed":["Current authoritative recruitment-adjustment guidance and case law where relevant.","A reviewed Northern Ireland recruitment-rights route."],"reopening_conditions":["Acas guidance or equality law changes.","New evidence or services materially change recruitment-access options."],"dissent":["An adjustment that removes a barrier for one applicant may change the assessment in ways another applicant does not want; individual agreement matters."]}
