{"schema_version":"0.2","id":"trauma-distress-ptsd-assessment-boundary","type":"question","status":"partially_resolved","provenance":{"created":"2026-09-03","created_by":"ND Oracle project-controlled curation","method":"Trauma/PTSD navigation question preserving diagnostic and treatment boundaries.","review_state":"editor_reviewed","last_reviewed":"2026-09-03"},"question":"I am struggling after something traumatic and wonder about PTSD. What can the Oracle do without diagnosing me or choosing treatment?","why_it_matters":"Trauma symptoms can be distressing and overlapping; a checklist or similarity to another person's experience is not enough for diagnosis or treatment selection.","related_objects":[{"type":"resource","id":"uk-urgent-mental-health-help"},{"type":"resource","id":"nhs-talking-therapies-england"}],"current_understanding":"ND Oracle can route to current NHS mental-health and urgent-help services and can explain that PTSD assessment belongs with appropriate professionals. It should not decide whether a traumatic experience caused PTSD, instruct someone to process traumatic memories alone, or choose a therapy. Immediate safety concerns use urgent routes.","evidence_needed":["Four-nation trauma-service navigation with neurodivergent accessibility information.","Evidence on adaptations to trauma-focused therapies for autistic and ADHD populations."],"reopening_conditions":["National PTSD or trauma access guidance changes.","Stronger governed evidence supports specific accessibility guidance."],"dissent":["Some people use trauma language outside formal diagnosis; acknowledging distress does not require deciding a diagnostic label."]}