{"schema_version":"0.2","id":"dyslexia-information-and-support-uk","type":"question","status":"partially_resolved","provenance":{"created":"2026-08-28","created_by":"ND Oracle project-controlled curation","method":"Practical discovery question assembled from the reviewed Dyslexia Concept and British Dyslexia Association Resource. It identifies a current UK information/signposting route without treating that organisation as a diagnostic authority for an individual.","review_state":"editor_reviewed","last_reviewed":"2026-08-28"},"question":"Where can I find dyslexia information or support in the UK?","why_it_matters":"People often need a practical route for questions about dyslexia, education, work, accessibility or assessment without knowing which organisation currently provides national signposting.","related_objects":[{"type":"concept","id":"dyslexia"},{"type":"resource","id":"british-dyslexia-association"}],"current_understanding":"The British Dyslexia Association is a current UK route in the ND Oracle catalogue for dyslexia information, support and signposting, including a national helpline. Its published scope includes education, work, accessibility, reasonable adjustments and questions about diagnosis. This identifies somewhere relevant to inspect; it does not establish a diagnosis, legal entitlement or that one organisation can answer every situation.","evidence_needed":["Current first-party evidence whenever the British Dyslexia Association changes its helpline, service scope or access arrangements.","Additional reviewed UK routes so the answer does not depend on a single organisation."],"reopening_conditions":["The British Dyslexia Association changes or closes the current helpline/support route.","A substantial new UK dyslexia support or rights route is added to the catalogue."],"dissent":["Different needs may be better served by education, workplace, clinical, legal or peer-support routes rather than a national charity helpline."]}