{"schema_version":"0.2","id":"disabled-neurodivergent-parent-service-access-uk","type":"question","status":"partially_resolved","provenance":{"created":"2026-09-03","created_by":"ND Oracle project-controlled curation","method":"Question created for the Relationships & family UK v1 bounded coverage slice from reviewed first-party/specialist routes and existing governed Concepts; it preserves uncertainty and does not create personalised relationship, diagnostic, legal or safeguarding authority.","review_state":"editor_reviewed","last_reviewed":"2026-09-03"},"question":"I'm a disabled or neurodivergent parent and a family service is hard to access — where can I start?","why_it_matters":"Parents can face barriers from phone-only contact, inaccessible meetings, sensory environments, forms or assumptions about how a parent should communicate.","related_objects":[{"type":"concept","id":"communication-differences"},{"type":"resource","id":"autistic-parents-uk"},{"type":"resource","id":"uk-disability-service-access-starting-points"}],"current_understanding":"The current starting point is to identify the access barrier and the jurisdiction. The official disability-access framework is not one UK statute: the EHRC route covers England, Scotland and Wales, while Northern Ireland has a separate Equality Commission route. A parent can describe the concrete barrier and adjustment they need, but ND Oracle cannot decide whether a person meets the legal definition of disability or whether a particular adjustment is legally reasonable.","evidence_needed":["More first-party material specifically addressing disabled parents using children's, education and family services.","Better four-nation examples of accessible parent communication that do not collapse service practice into legal entitlement."],"reopening_conditions":["A statutory or regulator source publishes parent-specific disability-access guidance.","The GB or Northern Ireland legal/service framework changes materially."],"dissent":["Being disabled or neurodivergent does not by itself imply parenting difficulty; the route is about access barriers faced by the parent."]}