{"schema_version":"0.2","id":"disabled-student-support-scotland","type":"question","status":"partially_resolved","provenance":{"created":"2026-08-31","created_by":"ND Oracle project-controlled curation","method":"Practical discovery question assembled from the reviewed SAAS Disabled Students' Allowance Resource and related Concepts. It records the current Scotland student-support route without making an individual eligibility decision.","review_state":"editor_reviewed","last_reviewed":"2026-08-31"},"question":"Where can I look for disability-related study support in higher education in Scotland?","why_it_matters":"Students may know that support exists but not whether it comes from SAAS, their university or college, a disability service or another route, and application rules can change.","related_objects":[{"type":"resource","id":"saas-disabled-students-allowance"},{"type":"concept","id":"autism"},{"type":"concept","id":"adhd"},{"type":"concept","id":"dyslexia"},{"type":"concept","id":"developmental-coordination-disorder"},{"type":"concept","id":"developmental-language-disorder"}],"current_understanding":"Student Awards Agency Scotland (SAAS) provides the current Disabled Students' Allowance route recorded in the ND Oracle catalogue for disability-related higher-education study costs in Scotland. Eligibility, evidence requirements and the support approved depend on the current rules and individual circumstances. University or college disability and accessibility support can exist alongside DSA.","evidence_needed":["Current SAAS Disabled Students' Allowance rules and application guidance.","Reviewed institutional support routes so the answer is not limited to DSA."],"reopening_conditions":["SAAS changes DSA eligibility, evidence, funding or application arrangements.","The responsible Scotland student-finance route changes.","Reviewed institutional or alternative support routes materially change the practical answer."],"dissent":["Disabled Students' Allowance is only one part of disabled-student support; institutional adjustments, accessibility, teaching practice and other support can matter separately."]}