{"schema_version":"0.2","id":"sensory-food-texture-smell-eating","type":"question","status":"partially_resolved","provenance":{"created":"2026-09-03","created_by":"ND Oracle project-controlled curation","method":"Food/eating question combining autism-specific practical guidance with clinical escalation boundaries.","review_state":"editor_reviewed","last_reviewed":"2026-09-03"},"question":"Food textures, smells, tastes or the eating environment make eating hard. What can I inspect?","why_it_matters":"Sensory differences can affect what, where and how someone can eat, while similar-looking restriction can also involve medical or eating-disorder concerns.","related_objects":[{"type":"concept","id":"sensory-processing"},{"type":"resource","id":"nas-autism-eating-guide"},{"type":"resource","id":"nhs-eating-disorders-arfid"}],"current_understanding":"Inspect the specific barrier rather than assuming a person is simply picky: texture, smell, temperature, mixed foods, noise, lighting or unpredictability may each matter. Practical sensory changes can be explored, but significant restriction, weight/growth change, nutritional concern, pica or eating-disorder symptoms need appropriate health advice.","evidence_needed":["Higher-quality comparative evidence for sensory-informed eating supports in autistic people.","Accessible dietetic and eating-disorder pathways for neurodivergent patients."],"reopening_conditions":["NHS eating-disorder or nutrition guidance changes materially.","Stronger evidence establishes specific sensory-support approaches."],"dissent":["Sensory explanations are important but should not become a catch-all that obscures gastrointestinal, dental, swallowing, allergy or mental-health causes."]}