{"schema_version":"0.2","id":"child-adhd-assessment-england","type":"question","status":"partially_resolved","provenance":{"created":"2026-09-03","created_by":"ND Oracle project-controlled curation","method":"Child/young-person England ADHD route assembled from current NHS and NICE guidance, keeping school support, specialist diagnosis, England Right to Choose and medication boundaries separate.","review_state":"editor_reviewed","last_reviewed":"2026-09-03"},"question":"How do I seek an ADHD assessment for a child or young person in England?","why_it_matters":"Families may encounter school support, GP referral, assessment waiting lists, private providers and medication information before understanding which step does what.","related_objects":[{"type":"concept","id":"adhd"},{"type":"resource","id":"nhs-adhd-children-young-people"},{"type":"resource","id":"nice-adhd-guideline"},{"type":"question","id":"send-support-school-college-england"}],"current_understanding":"The NHS says that if ADHD-like difficulties are affecting a child, speaking with teachers/SENCO and the GP are useful starting points. If support at home and school is not enough, a GP or SENCO may be asked about referral for an ADHD assessment. Specialist assessment considers symptoms, development, family life and information from school; a checklist or computer task is not by itself a diagnosis. Waiting may be months or years and support at home and school should continue while waiting. In England, Right to Choose may allow an eligible NHS assessment with another NHS-funded provider. Diagnosis is separate from any later medication, titration, prescribing or shared-care decision. ND Oracle does not diagnose a child from symptoms or recommend medication.","evidence_needed":["Current local child ADHD referral, waiting and pre/post-assessment support evidence across England."],"reopening_conditions":["NHS or NICE child ADHD guidance materially changes.","England Right to Choose rules materially change.","Local referral responsibility changes nationally."],"dissent":["A child can need meaningful educational or practical support even if ADHD is not diagnosed or assessment is still pending."]}
