{"schema_version":"0.2","id":"adult-adhd-assessment-england","type":"question","status":"partially_resolved","provenance":{"created":"2026-08-28","created_by":"ND Oracle project-controlled curation","method":"Practical discovery question assembled from reviewed ND Oracle Concepts and claimless Resource listings. The route distinguishes descriptive information, jurisdiction and access from claims that a strategy or service will work for an individual.","review_state":"editor_reviewed","last_reviewed":"2026-08-28"},"question":"How do I start looking into an adult ADHD assessment in England?","why_it_matters":"People can encounter symptom checklists and private or NHS routes before understanding what a formal ADHD diagnosis actually requires.","related_objects":[{"type":"concept","id":"adhd"},{"type":"concept","id":"executive-function"},{"type":"resource","id":"nhs-adhd-adults"},{"type":"resource","id":"nice-adhd-guideline"},{"type":"resource","id":"adhd-uk"}],"current_understanding":"The NHS adult ADHD page is the current public-health starting point in the catalogue, and NICE NG87 states that ADHD diagnosis should be made by an appropriately qualified specialist using a full clinical, developmental and psychosocial assessment rather than a rating scale alone. Referral routes and waiting times vary. ND Oracle does not interpret a checklist score as diagnosis or recommend a particular private provider.","evidence_needed":["Current NHS referral-pathway information, including regional variation and any England-specific choice routes.","Independent evidence on assessment access and post-diagnostic support."],"reopening_conditions":["NHS or NICE ADHD assessment guidance changes.","National referral or commissioning rules change.","The question is asked for another UK nation."],"dissent":["People can have substantial attention or executive difficulties without meeting ADHD diagnostic criteria; support needs and diagnostic status are related but not identical."]}
