{"schema_version":"0.2","id":"adhd-driving-dvla-great-britain","type":"question","status":"partially_resolved","provenance":{"created":"2026-08-28","created_by":"ND Oracle project-controlled curation","method":"Question assembled from current GOV.UK/DVLA ADHD and fitness-to-drive guidance. It preserves the distinction between diagnosis and an effect on safe driving and does not decide an individual's fitness to drive.","review_state":"editor_reviewed","last_reviewed":"2026-08-28"},"question":"Do I need to tell DVLA about ADHD or another neurodevelopmental condition in Great Britain?","why_it_matters":"People can be told conflicting blanket rules about diagnosis and driving, creating unnecessary fear or a risk of missing a real notification duty when safe driving is affected.","related_objects":[{"type":"resource","id":"govuk-adhd-driving"},{"type":"concept","id":"adhd"},{"type":"concept","id":"autism"},{"type":"concept","id":"executive-function"},{"type":"concept","id":"sensory-processing"}],"current_understanding":"Current DVLA guidance says ADHD must be reported when the condition or medication affects the ability to drive safely; the wider fitness-to-drive guidance says a neurodevelopmental diagnosis is not itself a bar to licensing. The exact notification decision depends on the person's circumstances, licence type and safety impact, so use the current official route and ask a clinician if unsure. Northern Ireland uses a separate licensing authority.","evidence_needed":["A reviewed Northern Ireland DVA route for neurodevelopmental conditions and driving.","Future DVLA updates if notification wording or licence rules change."],"reopening_conditions":["DVLA changes its ADHD/neurodevelopmental notification guidance.","A Northern Ireland equivalent is added."],"dissent":["This route cannot determine whether a person's symptoms or medication actually impair safe driving; that is an individual safety/medical question."]}